{
  "schemaVersion": 1,
  "fingerprint": "5b3e3599008683b0dd1278382cc786bce94a010bacd3e2224e2673f31b87362c",
  "plugin": {
    "name": "caisiyang123/dsh-tick-rail",
    "slug": "caisiyang123-dsh-tick-rail",
    "install": "dsh plugin --profile web add github:caisiyang123/dsh-tick-rail#2d103df93a7c4c11e43807cee525321b39730033",
    "profile": "web"
  },
  "environment": {
    "id": "linux-x64-dsh-0.1.1-rc.2",
    "label": "DSH 0.1.1-rc.2 on Linux x64",
    "surface": "profile",
    "os": "linux",
    "arch": "x64",
    "nodeVersion": "22",
    "pnpmVersion": "10.34.5",
    "dshVersion": "0.1.1-rc.2"
  },
  "status": "passed",
  "detail": "plugin installed, registered, and booted the profile help surface",
  "checks": {
    "install": {
      "status": "passed"
    },
    "registration": {
      "status": "passed"
    },
    "boot": {
      "status": "passed"
    }
  },
  "observed": {
    "bundles": [
      "@deepseek-ai/dsh-base",
      "@deepseek-ai/dsh-web-app",
      "dsh-tick-rail"
    ],
    "dependencies": [
      "dsh-tick-rail"
    ],
    "blockedBuildScripts": []
  },
  "outputDigest": "7aff171e149eaee9f21a0739f6881b5c7a37cc5d165e85ad434ac818c452797c",
  "testedAt": "2026-09-16T21:41:06.979Z",
  "runner": {
    "repository": "MeCKodo/dsh-compatibility-lab",
    "revision": "8a7d21969a9d6cfeac07e5b6ff681bc63d97b335",
    "version": "1.0.0"
  }
}
