{
  "schemaVersion": 1,
  "fingerprint": "2394a9e2df453759e855cdb16f2b51c02358d0b77a1c38a7612ef94f9bd4a0be",
  "plugin": {
    "name": "534119219/chicheng-quickinput",
    "slug": "534119219-chicheng-quickinput",
    "install": "dsh plugin --profile web add github:534119219/chicheng-quickinput",
    "profile": "web"
  },
  "environment": {
    "id": "linux-x64-dsh-0.1.0-rc.7",
    "label": "DSH 0.1.0-rc.7 on Linux x64",
    "surface": "profile",
    "os": "linux",
    "arch": "x64",
    "nodeVersion": "22",
    "pnpmVersion": "10.34.5",
    "dshVersion": "0.1.0-rc.7"
  },
  "status": "passed",
  "detail": "plugin installed, registered, and booted the profile help surface",
  "checks": {
    "install": {
      "status": "passed"
    },
    "registration": {
      "status": "passed"
    },
    "boot": {
      "status": "passed"
    }
  },
  "observed": {
    "bundles": [
      "@deepseek-ai/dsh-base",
      "@deepseek-ai/dsh-web-app",
      "chicheng-vault"
    ],
    "dependencies": [
      "chicheng-vault"
    ],
    "blockedBuildScripts": []
  },
  "outputDigest": "20be4d574a16dd497967fadd69f966c6e27da57171a72f5a6803cf710df89fa0",
  "testedAt": "2026-09-15T12:09:35.391Z",
  "runner": {
    "repository": "MeCKodo/dsh-compatibility-lab",
    "revision": "acefd83d1017a68d52e256fea8816075024b4b5e",
    "version": "1.0.0"
  }
}
