{
  "schemaVersion": 1,
  "fingerprint": "a1a18d22cc66bd5cf4870ed3a8a3e0177bca63da96f48f8bb7adaaa07300cee2",
  "plugin": {
    "name": "jkamkk/dsh-liquid-glass-input",
    "slug": "jkamkk-dsh-liquid-glass-input",
    "install": "dsh plugin --profile web add github:jkamkk/dsh-liquid-glass-input",
    "profile": "web"
  },
  "environment": {
    "id": "linux-x64-dsh-0.1.0-rc.7",
    "label": "DSH 0.1.0-rc.7 on Linux x64",
    "surface": "profile",
    "os": "linux",
    "arch": "x64",
    "nodeVersion": "22",
    "pnpmVersion": "10.34.5",
    "dshVersion": "0.1.0-rc.7"
  },
  "status": "passed",
  "detail": "plugin installed, registered, and booted the profile help surface",
  "checks": {
    "install": {
      "status": "passed"
    },
    "registration": {
      "status": "passed"
    },
    "boot": {
      "status": "passed"
    }
  },
  "observed": {
    "bundles": [
      "@deepseek-ai/dsh-base",
      "@deepseek-ai/dsh-web-app",
      "dsh-liquid-glass-input"
    ],
    "dependencies": [
      "dsh-liquid-glass-input"
    ],
    "blockedBuildScripts": []
  },
  "outputDigest": "25e94a79ba87d8316f108472bd8027c44cf57f4277a93910b54174c9daf6d073",
  "testedAt": "2026-09-19T05:05:56.554Z",
  "runner": {
    "repository": "MeCKodo/dsh-compatibility-lab",
    "revision": "d7371fbf0fcbd95b10acd33319652ea58ae37d3d",
    "version": "1.0.0"
  }
}
