{
  "schemaVersion": 1,
  "fingerprint": "08c0c3be25e38448c5c34acec2413cc2182ed6ccc6cf4ba367b3f797fb6a4aa3",
  "plugin": {
    "name": "NanmiCoder/dsh-agent-teams",
    "slug": "nanmicoder-dsh-agent-teams",
    "install": "dsh plugin --profile web add @nanmicoder/dsh-agent-teams@0.1.14",
    "profile": "web"
  },
  "environment": {
    "id": "linux-x64-dsh-0.1.0-rc.7",
    "label": "DSH 0.1.0-rc.7 on Linux x64",
    "surface": "profile",
    "os": "linux",
    "arch": "x64",
    "nodeVersion": "22",
    "pnpmVersion": "10.34.5",
    "dshVersion": "0.1.0-rc.7"
  },
  "status": "passed",
  "detail": "plugin installed, registered, and booted the profile help surface",
  "checks": {
    "install": {
      "status": "passed"
    },
    "registration": {
      "status": "passed"
    },
    "boot": {
      "status": "passed"
    }
  },
  "observed": {
    "bundles": [
      "@deepseek-ai/dsh-base",
      "@deepseek-ai/dsh-web-app",
      "@nanmicoder/dsh-agent-teams"
    ],
    "dependencies": [
      "@nanmicoder/dsh-agent-teams"
    ],
    "blockedBuildScripts": []
  },
  "outputDigest": "fd87b7495bc06489efe28f81808f9878a8b73e616ecb12714a0d2e215d50a5b9",
  "testedAt": "2026-08-29T17:13:28.667Z",
  "runner": {
    "repository": "MeCKodo/dsh-compatibility-lab",
    "revision": "340b5b24f3861ae7d8883e65facdc0953311617d",
    "version": "1.0.0"
  }
}
