{
  "schemaVersion": 1,
  "fingerprint": "1093abf3a762e97e09e39b881bdbb145be6d1e9c630b40b70c75e40dde8b15de",
  "plugin": {
    "name": "kuanfu0430/dsh-sidebar-branch-chat",
    "slug": "kuanfu0430-dsh-sidebar-branch-chat",
    "install": "dsh plugin --profile web add github:kuanfu0430/dsh-sidebar-branch-chat",
    "profile": "web"
  },
  "environment": {
    "id": "linux-x64-dsh-0.1.0-rc.7",
    "label": "DSH 0.1.0-rc.7 on Linux x64",
    "surface": "profile",
    "os": "linux",
    "arch": "x64",
    "nodeVersion": "22",
    "pnpmVersion": "10.34.5",
    "dshVersion": "0.1.0-rc.7"
  },
  "status": "passed",
  "detail": "plugin installed, registered, and booted the profile help surface",
  "checks": {
    "install": {
      "status": "passed"
    },
    "registration": {
      "status": "passed"
    },
    "boot": {
      "status": "passed"
    }
  },
  "observed": {
    "bundles": [
      "@deepseek-ai/dsh-base",
      "@deepseek-ai/dsh-web-app",
      "@kuanfu0430/dsh-sidebar-branch-chat"
    ],
    "dependencies": [
      "@kuanfu0430/dsh-sidebar-branch-chat"
    ],
    "blockedBuildScripts": []
  },
  "outputDigest": "9df690c282073690dd3f330e0b04b070b9d0749f0dfb20f9f9d04b2a3db442aa",
  "testedAt": "2026-09-19T16:05:20.047Z",
  "runner": {
    "repository": "MeCKodo/dsh-compatibility-lab",
    "revision": "726421f917dc6c8023443bdd201529d96791ac67",
    "version": "1.0.0"
  }
}
