{
  "schemaVersion": 1,
  "fingerprint": "97f2af1fed6e21d82a364c1876119b9ae1720df5bc94ead4c72587e9133f97b4",
  "plugin": {
    "name": "keleus/deepseek-pet",
    "slug": "keleus-deepseek-pet",
    "install": "dsh plugin --profile web add deepseek-pet@0.1.0",
    "profile": "web"
  },
  "environment": {
    "id": "linux-x64-dsh-0.1.0-rc.7",
    "label": "DSH 0.1.0-rc.7 on Linux x64",
    "surface": "profile",
    "os": "linux",
    "arch": "x64",
    "nodeVersion": "22",
    "pnpmVersion": "10.34.5",
    "dshVersion": "0.1.0-rc.7"
  },
  "status": "passed",
  "detail": "plugin installed, registered, and booted the profile help surface",
  "checks": {
    "install": {
      "status": "passed"
    },
    "registration": {
      "status": "passed"
    },
    "boot": {
      "status": "passed"
    }
  },
  "observed": {
    "bundles": [
      "@deepseek-ai/dsh-base",
      "@deepseek-ai/dsh-web-app",
      "deepseek-pet"
    ],
    "dependencies": [
      "deepseek-pet"
    ],
    "blockedBuildScripts": []
  },
  "outputDigest": "920cebe6982afc56f794c3df447697a8a7c6d95c27899088f977d756109c9635",
  "testedAt": "2026-08-29T17:20:14.359Z",
  "runner": {
    "repository": "MeCKodo/dsh-compatibility-lab",
    "revision": "d4eeb7683d15ac2dac4a215e7945d2ed53ff8318",
    "version": "1.0.0"
  }
}
