{
  "schemaVersion": 1,
  "fingerprint": "027450d2942e5eeed53c39be756a535cf80bc2e9a2024d831195f6c87f67a423",
  "plugin": {
    "name": "pyf2818/dsh-bili-widget",
    "slug": "pyf2818-dsh-bili-widget",
    "install": "dsh plugin --profile web add github:pyf2818/dsh-bili-widget#7d564f5f134389a905b5f39485469d602eee2b4a",
    "profile": "web"
  },
  "environment": {
    "id": "linux-x64-dsh-0.1.0-rc.7",
    "label": "DSH 0.1.0-rc.7 on Linux x64",
    "surface": "profile",
    "os": "linux",
    "arch": "x64",
    "nodeVersion": "22",
    "pnpmVersion": "10.34.5",
    "dshVersion": "0.1.0-rc.7"
  },
  "status": "passed",
  "detail": "plugin installed, registered, and booted the profile help surface",
  "checks": {
    "install": {
      "status": "passed"
    },
    "registration": {
      "status": "passed"
    },
    "boot": {
      "status": "passed"
    }
  },
  "observed": {
    "bundles": [
      "@deepseek-ai/dsh-base",
      "@deepseek-ai/dsh-web-app",
      "@dsh-external/dsh-bili-widget"
    ],
    "dependencies": [
      "@dsh-external/dsh-bili-widget"
    ],
    "blockedBuildScripts": []
  },
  "outputDigest": "d95e70b3a406c921ca872f44e42fc8048e520163aa74b2e89f917664e706d424",
  "testedAt": "2026-09-14T22:08:09.667Z",
  "runner": {
    "repository": "MeCKodo/dsh-compatibility-lab",
    "revision": "d07586a0a64ff43c30d3e26b052552d5a601aad1",
    "version": "1.0.0"
  }
}
