{
  "schemaVersion": 1,
  "fingerprint": "95a2a1e4437524a09720e1bcc04ee99de79e9d1028ade1c37d0606a47b2f0da6",
  "plugin": {
    "name": "cuhaitiang0405-collab/dsh-indexbookmark",
    "slug": "cuhaitiang0405-collab-dsh-indexbookmark",
    "install": "dsh plugin --profile web add github:cuhaitiang0405-collab/dsh-indexbookmark",
    "profile": "web"
  },
  "environment": {
    "id": "linux-x64-dsh-0.1.0-rc.7",
    "label": "DSH 0.1.0-rc.7 on Linux x64",
    "surface": "profile",
    "os": "linux",
    "arch": "x64",
    "nodeVersion": "22",
    "pnpmVersion": "10.34.5",
    "dshVersion": "0.1.0-rc.7"
  },
  "status": "passed",
  "detail": "plugin installed, registered, and booted the profile help surface",
  "checks": {
    "install": {
      "status": "passed"
    },
    "registration": {
      "status": "passed"
    },
    "boot": {
      "status": "passed"
    }
  },
  "observed": {
    "bundles": [
      "@deepseek-ai/dsh-base",
      "@deepseek-ai/dsh-web-app",
      "dsh-indexbookmark"
    ],
    "dependencies": [
      "dsh-indexbookmark"
    ],
    "blockedBuildScripts": []
  },
  "outputDigest": "d1af0e0152e87e35d5c345cd1d414d4378ce56e062b9c6f57b1cced5f3162fbe",
  "testedAt": "2026-09-17T05:20:47.215Z",
  "runner": {
    "repository": "MeCKodo/dsh-compatibility-lab",
    "revision": "08d146cf78b65a71bf01f1385280f36c6e7bd087",
    "version": "1.0.0"
  }
}
