{
  "schemaVersion": 1,
  "fingerprint": "56f202b571b068e3b3f423be29747d3a744448fbca0471a13b3058969b01f49c",
  "plugin": {
    "name": "lemonorangeapple/dsh-effort-switcher",
    "slug": "lemonorangeapple-dsh-effort-switcher",
    "install": "dsh plugin --profile web add github:lemonorangeapple/dsh-effort-switcher",
    "profile": "web"
  },
  "environment": {
    "id": "linux-x64-dsh-0.1.0-rc.7",
    "label": "DSH 0.1.0-rc.7 on Linux x64",
    "surface": "profile",
    "os": "linux",
    "arch": "x64",
    "nodeVersion": "22",
    "pnpmVersion": "10.34.5",
    "dshVersion": "0.1.0-rc.7"
  },
  "status": "passed",
  "detail": "plugin installed, registered, and booted the profile help surface",
  "checks": {
    "install": {
      "status": "passed"
    },
    "registration": {
      "status": "passed"
    },
    "boot": {
      "status": "passed"
    }
  },
  "observed": {
    "bundles": [
      "@deepseek-ai/dsh-base",
      "@deepseek-ai/dsh-web-app",
      "dsh-effort-switcher"
    ],
    "dependencies": [
      "dsh-effort-switcher"
    ],
    "blockedBuildScripts": []
  },
  "outputDigest": "e7d0808d0697ecb8365eb825ab0eee9856f117d7ade7e66eb183776dce973f9f",
  "testedAt": "2026-09-19T20:59:04.974Z",
  "runner": {
    "repository": "MeCKodo/dsh-compatibility-lab",
    "revision": "f9723b79513d5942b0dabe0fce213bb6188be93e",
    "version": "1.0.0"
  }
}
