{
  "schemaVersion": 1,
  "fingerprint": "a91deff10303eeb09fe92bb8e48c3d2477c26941307e6cfcc0af5c8a9c813490",
  "plugin": {
    "name": "AKS1st/dock-editor",
    "slug": "aks1st-dock-editor",
    "install": "dsh plugin --profile web add github:AKS1st/dock-editor",
    "profile": "web"
  },
  "environment": {
    "id": "linux-x64-dsh-0.1.0-rc.7",
    "label": "DSH 0.1.0-rc.7 on Linux x64",
    "surface": "profile",
    "os": "linux",
    "arch": "x64",
    "nodeVersion": "22",
    "pnpmVersion": "10.34.5",
    "dshVersion": "0.1.0-rc.7"
  },
  "status": "passed",
  "detail": "plugin installed, registered, and booted the profile help surface",
  "checks": {
    "install": {
      "status": "passed"
    },
    "registration": {
      "status": "passed"
    },
    "boot": {
      "status": "passed"
    }
  },
  "observed": {
    "bundles": [
      "@deepseek-ai/dsh-base",
      "@deepseek-ai/dsh-web-app",
      "dock-editor"
    ],
    "dependencies": [
      "dock-editor"
    ],
    "blockedBuildScripts": []
  },
  "outputDigest": "4f3ddac6325d1803e6d750939fbdaadcb4335b11cc0b5fbb05827a1bef4096c1",
  "testedAt": "2026-09-15T21:45:50.284Z",
  "runner": {
    "repository": "MeCKodo/dsh-compatibility-lab",
    "revision": "7b643f91598adb96a32d2e834d6b54689474e2bc",
    "version": "1.0.0"
  }
}
