{
  "schemaVersion": 1,
  "fingerprint": "56c7325aaa50e06c51675f2aaf741287caa3983e5503d7bd0b6b8921b2f58805",
  "plugin": {
    "name": "lk251066/dsh-tui-pro",
    "slug": "lk251066-dsh-tui-pro",
    "install": "dsh plugin --profile tui add @lk251066/dsh-tui",
    "profile": "tui"
  },
  "environment": {
    "id": "linux-x64-dsh-0.1.0-rc.7",
    "label": "DSH 0.1.0-rc.7 on Linux x64",
    "surface": "profile",
    "os": "linux",
    "arch": "x64",
    "nodeVersion": "22",
    "pnpmVersion": "10.34.5",
    "dshVersion": "0.1.0-rc.7"
  },
  "status": "boot-failed",
  "detail": "registered plugin caused the profile help surface to fail during boot",
  "checks": {
    "install": {
      "status": "passed"
    },
    "registration": {
      "status": "passed"
    },
    "boot": {
      "status": "failed"
    }
  },
  "observed": {
    "bundles": [
      "@deepseek-ai/dsh-base",
      "@lk251066/dsh-tui"
    ],
    "dependencies": [
      "@lk251066/dsh-tui"
    ],
    "blockedBuildScripts": []
  },
  "outputDigest": "11e54dbc1cba5124cc6697bd97c9b6ce22e601161f7de79f2af326c0c137d6de",
  "testedAt": "2026-09-20T05:23:11.258Z",
  "runner": {
    "repository": "MeCKodo/dsh-compatibility-lab",
    "revision": "c6454f41f4667695d2ec1134221682fa6753b2df",
    "version": "1.0.0"
  }
}
