{
  "schemaVersion": 1,
  "fingerprint": "b57e8f2b5a3bed5aeac597e85387e0a9a5cce1d4d16e4a7efd87d2da912ad5b9",
  "plugin": {
    "name": "k-ying/dsh-vsceditor",
    "slug": "k-ying-dsh-vsceditor",
    "install": "dsh plugin --profile web add github:k-ying/dsh-vsceditor",
    "profile": "web"
  },
  "environment": {
    "id": "linux-x64-dsh-0.1.0-rc.7",
    "label": "DSH 0.1.0-rc.7 on Linux x64",
    "surface": "profile",
    "os": "linux",
    "arch": "x64",
    "nodeVersion": "22",
    "pnpmVersion": "10.34.5",
    "dshVersion": "0.1.0-rc.7"
  },
  "status": "passed",
  "detail": "plugin installed, registered, and booted the profile help surface",
  "checks": {
    "install": {
      "status": "passed"
    },
    "registration": {
      "status": "passed"
    },
    "boot": {
      "status": "passed"
    }
  },
  "observed": {
    "bundles": [
      "@deepseek-ai/dsh-base",
      "@deepseek-ai/dsh-web-app",
      "dsh-vsceditor"
    ],
    "dependencies": [
      "dsh-vsceditor"
    ],
    "blockedBuildScripts": []
  },
  "outputDigest": "b8588180c8e456fea5bf5c0a4d8ff3b9599da8cf128e18c8c1a51aefc70895ff",
  "testedAt": "2026-09-19T11:29:00.812Z",
  "runner": {
    "repository": "MeCKodo/dsh-compatibility-lab",
    "revision": "f701fc67baf4e1845e8ce6965e7bbc89a6135156",
    "version": "1.0.0"
  }
}
