{
  "schemaVersion": 1,
  "fingerprint": "c8a188cd3121d7da2b4a94b8854258c45702d78e12bab1ded82b975ba0c15c03",
  "plugin": {
    "name": "asukasec/dsh-message-preview",
    "slug": "asukasec-dsh-message-preview",
    "install": "dsh plugin --profile web add github:asukasec/dsh-message-preview#main",
    "profile": "web"
  },
  "environment": {
    "id": "linux-x64-dsh-0.1.0-rc.7",
    "label": "DSH 0.1.0-rc.7 on Linux x64",
    "surface": "profile",
    "os": "linux",
    "arch": "x64",
    "nodeVersion": "22",
    "pnpmVersion": "10.34.5",
    "dshVersion": "0.1.0-rc.7"
  },
  "status": "passed",
  "detail": "plugin installed, registered, and booted the profile help surface",
  "checks": {
    "install": {
      "status": "passed"
    },
    "registration": {
      "status": "passed"
    },
    "boot": {
      "status": "passed"
    }
  },
  "observed": {
    "bundles": [
      "@deepseek-ai/dsh-base",
      "@deepseek-ai/dsh-web-app",
      "dsh-message-preview"
    ],
    "dependencies": [
      "dsh-message-preview"
    ],
    "blockedBuildScripts": []
  },
  "outputDigest": "ed47080bc11e14d9efe462bf75c1aa5c5382cc1a071a6dd044e9327473eb261b",
  "testedAt": "2026-09-16T12:06:08.357Z",
  "runner": {
    "repository": "MeCKodo/dsh-compatibility-lab",
    "revision": "3362be6614e354b6f59348dcafa578951753ba58",
    "version": "1.0.0"
  }
}
