{
  "schemaVersion": 1,
  "fingerprint": "c073d47aa81b1706c455f2a6663e5e1a82be7e0503a3938b7ecb58e1cc490fd2",
  "plugin": {
    "name": "Laplace-bit/dsh-smooth-stream",
    "slug": "laplace-bit-dsh-smooth-stream",
    "install": "dsh plugin --profile web add dsh-smooth-stream",
    "profile": "web"
  },
  "environment": {
    "id": "linux-x64-dsh-0.1.1-rc.2",
    "label": "DSH 0.1.1-rc.2 on Linux x64",
    "surface": "profile",
    "os": "linux",
    "arch": "x64",
    "nodeVersion": "22",
    "pnpmVersion": "10.34.5",
    "dshVersion": "0.1.1-rc.2"
  },
  "status": "passed",
  "detail": "plugin installed, registered, and booted the profile help surface",
  "checks": {
    "install": {
      "status": "passed"
    },
    "registration": {
      "status": "passed"
    },
    "boot": {
      "status": "passed"
    }
  },
  "observed": {
    "bundles": [
      "@deepseek-ai/dsh-base",
      "@deepseek-ai/dsh-web-app",
      "dsh-smooth-stream"
    ],
    "dependencies": [
      "dsh-smooth-stream"
    ],
    "blockedBuildScripts": []
  },
  "outputDigest": "32a82bc9e1e02dd794f0e516d4333d0430a0b6787e5da7e2aa41488fc888b8bd",
  "testedAt": "2026-09-19T16:07:52.165Z",
  "runner": {
    "repository": "MeCKodo/dsh-compatibility-lab",
    "revision": "726421f917dc6c8023443bdd201529d96791ac67",
    "version": "1.0.0"
  }
}
