{
  "schemaVersion": 1,
  "fingerprint": "9351fdd313cb95d1554d7296b0230044c49fd944ecd9d67fe248b61d1eb35fe8",
  "plugin": {
    "name": "Jiyr0119/dsh-workspace-explorer",
    "slug": "jiyr0119-dsh-workspace-explorer",
    "install": "dsh plugin --profile web add -w",
    "profile": "web"
  },
  "environment": {
    "id": "linux-x64-dsh-0.1.1-rc.2",
    "label": "DSH 0.1.1-rc.2 on Linux x64",
    "surface": "profile",
    "os": "linux",
    "arch": "x64",
    "nodeVersion": "22",
    "pnpmVersion": "10.34.5",
    "dshVersion": "0.1.1-rc.2"
  },
  "status": "failed",
  "detail": "install target was not an allowed npm or GitHub spec",
  "checks": {
    "install": {
      "status": "rejected"
    },
    "registration": {
      "status": "not-run"
    },
    "boot": {
      "status": "not-run"
    }
  },
  "observed": {
    "bundles": [],
    "dependencies": [],
    "blockedBuildScripts": []
  },
  "outputDigest": null,
  "testedAt": "2026-09-19T05:04:17.095Z",
  "runner": {
    "repository": "MeCKodo/dsh-compatibility-lab",
    "revision": "d7371fbf0fcbd95b10acd33319652ea58ae37d3d",
    "version": "1.0.0"
  }
}
