{
  "schemaVersion": 1,
  "fingerprint": "f6e224ff4089bd11d9eec0d480d4d4f26c09f8ca45b0add410c32e05c337cc65",
  "plugin": {
    "name": "openma-ai/Martty",
    "slug": "openma-ai-martty",
    "install": "dsh plugin --profile martty add martty@latest",
    "profile": "martty"
  },
  "environment": {
    "id": "linux-x64-dsh-0.1.0-rc.7",
    "label": "DSH 0.1.0-rc.7 on Linux x64",
    "surface": "profile",
    "os": "linux",
    "arch": "x64",
    "nodeVersion": "22",
    "pnpmVersion": "10.34.5",
    "dshVersion": "0.1.0-rc.7"
  },
  "status": "passed",
  "detail": "plugin installed, registered, and booted the profile help surface",
  "checks": {
    "install": {
      "status": "passed"
    },
    "registration": {
      "status": "passed"
    },
    "boot": {
      "status": "passed"
    }
  },
  "observed": {
    "bundles": [
      "@deepseek-ai/dsh-base",
      "martty"
    ],
    "dependencies": [
      "martty"
    ],
    "blockedBuildScripts": []
  },
  "outputDigest": "8050bcf575b8e108d5d619e7c904ecf15ebb9bd68c51e860a5dc5aff226e21eb",
  "testedAt": "2026-09-14T13:19:54.763Z",
  "runner": {
    "repository": "MeCKodo/dsh-compatibility-lab",
    "revision": "56f36e9723a174815c9310842c38808d3433cb5f",
    "version": "1.0.0"
  }
}
