{
  "schemaVersion": 1,
  "fingerprint": "d3c6d0b929efd8b237051f64acad495b1b495fa8482fb3e2ecb736b732fec2ee",
  "plugin": {
    "name": "AcidGr/dsh-web-mobile-fix",
    "slug": "acidgr-dsh-web-mobile-fix",
    "install": "dsh plugin --profile web add github:AcidGr/dsh-web-mobile-fix",
    "profile": "web"
  },
  "environment": {
    "id": "linux-x64-dsh-0.1.1-rc.2",
    "label": "DSH 0.1.1-rc.2 on Linux x64",
    "surface": "profile",
    "os": "linux",
    "arch": "x64",
    "nodeVersion": "22",
    "pnpmVersion": "10.34.5",
    "dshVersion": "0.1.1-rc.2"
  },
  "status": "passed",
  "detail": "plugin installed, registered, and booted the profile help surface",
  "checks": {
    "install": {
      "status": "passed"
    },
    "registration": {
      "status": "passed"
    },
    "boot": {
      "status": "passed"
    }
  },
  "observed": {
    "bundles": [
      "@deepseek-ai/dsh-base",
      "@deepseek-ai/dsh-web-app",
      "dsh-web-mobile-fix"
    ],
    "dependencies": [
      "dsh-web-mobile-fix"
    ],
    "blockedBuildScripts": []
  },
  "outputDigest": "60edc1b0f02ae091acbb3718026ec294856070efb5cfe2eb1637aa884b06aff6",
  "testedAt": "2026-09-15T17:22:13.260Z",
  "runner": {
    "repository": "MeCKodo/dsh-compatibility-lab",
    "revision": "efaeeaa733b11f743481cf386b607ff918f1983a",
    "version": "1.0.0"
  }
}
