{
  "schemaVersion": 1,
  "fingerprint": "bd0b90092e32f097f832e5ec200062cffa59f6ee0748ac8c342722e529016ddc",
  "plugin": {
    "name": "GooDAnDReaDY/dsh-russian-lang",
    "slug": "goodandready-dsh-russian-lang",
    "install": "dsh plugin --profile web add @goodandready/dsh-russian-lang",
    "profile": "web"
  },
  "environment": {
    "id": "linux-x64-dsh-0.1.1-rc.2",
    "label": "DSH 0.1.1-rc.2 on Linux x64",
    "surface": "profile",
    "os": "linux",
    "arch": "x64",
    "nodeVersion": "22",
    "pnpmVersion": "10.34.5",
    "dshVersion": "0.1.1-rc.2"
  },
  "status": "passed",
  "detail": "plugin installed, registered, and booted the profile help surface",
  "checks": {
    "install": {
      "status": "passed"
    },
    "registration": {
      "status": "passed"
    },
    "boot": {
      "status": "passed"
    }
  },
  "observed": {
    "bundles": [
      "@deepseek-ai/dsh-base",
      "@deepseek-ai/dsh-web-app",
      "@goodandready/dsh-russian-lang"
    ],
    "dependencies": [
      "@goodandready/dsh-russian-lang"
    ],
    "blockedBuildScripts": []
  },
  "outputDigest": "8a28936a5f4f6d57f8172edd020eb1bf50fcf2751f24cc365b092ffbcc4fc34f",
  "testedAt": "2026-09-18T11:47:50.331Z",
  "runner": {
    "repository": "MeCKodo/dsh-compatibility-lab",
    "revision": "f23a2b4a6ebc41173e085d66531ffbea37ee27ca",
    "version": "1.0.0"
  }
}
