{
  "schemaVersion": 1,
  "fingerprint": "822b858a91b5e859dbd269124d02b9b1b3382a0698b175313e2d730dfa54f519",
  "plugin": {
    "name": "DIAG5/dsh-better-input",
    "slug": "diag5-dsh-better-input",
    "install": "dsh plugin --profile web add github:DIAG5/dsh-better-input",
    "profile": "web"
  },
  "environment": {
    "id": "linux-x64-dsh-0.1.1-rc.2",
    "label": "DSH 0.1.1-rc.2 on Linux x64",
    "surface": "profile",
    "os": "linux",
    "arch": "x64",
    "nodeVersion": "22",
    "pnpmVersion": "10.34.5",
    "dshVersion": "0.1.1-rc.2"
  },
  "status": "passed",
  "detail": "plugin installed, registered, and booted the profile help surface",
  "checks": {
    "install": {
      "status": "passed"
    },
    "registration": {
      "status": "passed"
    },
    "boot": {
      "status": "passed"
    }
  },
  "observed": {
    "bundles": [
      "@deepseek-ai/dsh-base",
      "@deepseek-ai/dsh-web-app",
      "dsh-better-input"
    ],
    "dependencies": [
      "dsh-better-input"
    ],
    "blockedBuildScripts": []
  },
  "outputDigest": "55ca67425cd61d317a1d6fc58c023a0789dbb94d033ff45d40786611514b96cb",
  "testedAt": "2026-09-17T12:07:11.752Z",
  "runner": {
    "repository": "MeCKodo/dsh-compatibility-lab",
    "revision": "647178aa268f711e7eef9c3cd9100deb2e1e060c",
    "version": "1.0.0"
  }
}
