{
  "schemaVersion": 1,
  "fingerprint": "048810b81b218cce5bca3637b72aeeffd0650b71ecb7b89da98189086366c20f",
  "plugin": {
    "name": "magicOF2/dsh-schedule",
    "slug": "magicof2-dsh-schedule",
    "install": "dsh plugin --profile web add github:magicOF2/dsh-schedule#e16a386244b2d4de626f6feacc8f401fd875321d",
    "profile": "web"
  },
  "environment": {
    "id": "linux-x64-dsh-0.1.0-rc.7",
    "label": "DSH 0.1.0-rc.7 on Linux x64",
    "surface": "profile",
    "os": "linux",
    "arch": "x64",
    "nodeVersion": "22",
    "pnpmVersion": "10.34.5",
    "dshVersion": "0.1.0-rc.7"
  },
  "status": "passed",
  "detail": "plugin installed, registered, and booted the profile help surface",
  "checks": {
    "install": {
      "status": "passed"
    },
    "registration": {
      "status": "passed"
    },
    "boot": {
      "status": "passed"
    }
  },
  "observed": {
    "bundles": [
      "@deepseek-ai/dsh-base",
      "@deepseek-ai/dsh-web-app",
      "dsh-schedule"
    ],
    "dependencies": [
      "dsh-schedule"
    ],
    "blockedBuildScripts": []
  },
  "outputDigest": "0db9155c6b5aae2929d18a9307dfe1e5a20544ad65ae2062f9b5b993a2870450",
  "testedAt": "2026-09-20T11:52:08.656Z",
  "runner": {
    "repository": "MeCKodo/dsh-compatibility-lab",
    "revision": "530a71f9347c51d3f957a9f949a71310dec51238",
    "version": "1.0.0"
  }
}
