{
  "schemaVersion": 1,
  "fingerprint": "11a6c64eafd44c1f57698ed381ad275427ae66b513d428f6862de6f7aa036ed6",
  "plugin": {
    "name": "MDR-EX1000/dsh-desktop-kit",
    "slug": "mdr-ex1000-dsh-desktop-kit",
    "install": "dsh plugin --profile web add dsh-desktop-kit",
    "profile": "web"
  },
  "environment": {
    "id": "linux-x64-dsh-0.1.0-rc.7",
    "label": "DSH 0.1.0-rc.7 on Linux x64",
    "surface": "profile",
    "os": "linux",
    "arch": "x64",
    "nodeVersion": "22",
    "pnpmVersion": "10.34.5",
    "dshVersion": "0.1.0-rc.7"
  },
  "status": "failed",
  "detail": "package did not register as a profile bundle",
  "checks": {
    "install": {
      "status": "failed"
    },
    "registration": {
      "status": "failed"
    },
    "boot": {
      "status": "not-run"
    }
  },
  "observed": {
    "bundles": [
      "@deepseek-ai/dsh-base",
      "@deepseek-ai/dsh-web-app"
    ],
    "dependencies": [],
    "blockedBuildScripts": []
  },
  "outputDigest": "a6551a35e0d75b5bddc7eb16e5f49b7c3ef4d009d609cfcdca3cb219beda073b",
  "testedAt": "2026-09-13T16:37:47.951Z",
  "runner": {
    "repository": "MeCKodo/dsh-compatibility-lab",
    "revision": "d7f386ac1128d6e9ec02d5ef13bdda5a6b15d609",
    "version": "1.0.0"
  }
}
