{
  "schemaVersion": 1,
  "fingerprint": "4d101ee55c0ded63fe48863b73d05f8b99dbab5f61dedbdc77d1f919867bdc56",
  "plugin": {
    "name": "hyrinx/dsh-plugin-open-with",
    "slug": "hyrinx-dsh-plugin-open-with",
    "install": "dsh plugin --profile web add github:hyrinx/dsh-plugin-open-with#9f23dfa7fdf1f0a91a8888a5b2754410e4e15ec9",
    "profile": "web"
  },
  "environment": {
    "id": "linux-x64-dsh-0.1.0-rc.7",
    "label": "DSH 0.1.0-rc.7 on Linux x64",
    "surface": "profile",
    "os": "linux",
    "arch": "x64",
    "nodeVersion": "22",
    "pnpmVersion": "10.34.5",
    "dshVersion": "0.1.0-rc.7"
  },
  "status": "passed",
  "detail": "plugin installed, registered, and booted the profile help surface",
  "checks": {
    "install": {
      "status": "passed"
    },
    "registration": {
      "status": "passed"
    },
    "boot": {
      "status": "passed"
    }
  },
  "observed": {
    "bundles": [
      "@deepseek-ai/dsh-base",
      "@deepseek-ai/dsh-web-app",
      "dsh-plugin-open-with"
    ],
    "dependencies": [
      "dsh-plugin-open-with"
    ],
    "blockedBuildScripts": []
  },
  "outputDigest": "ed4a4932b17ff6c7d77f4a83f89124fba7ce136cf9b4b25beef57e5d5efa883e",
  "testedAt": "2026-09-18T21:17:08.894Z",
  "runner": {
    "repository": "MeCKodo/dsh-compatibility-lab",
    "revision": "2e45239368d0ae212f49a8eb2411c0dc5a6c4ef2",
    "version": "1.0.0"
  }
}
